{
  "recordKind": "hacp.v0_3_candidate.agent_report",
  "schemaVersion": "hacp-0.3-candidate",
  "reportId": "report_wits_hacp_v03_success",
  "returnedAt": "2026-09-08T03:01:37.401Z",
  "continuationContext": {
    "id": "context_wits_01a07ef6_c79c_7e65_9180_409d631fb27d",
    "digest": {
      "value": "1ba9c337c060cfc41779200f613f7640b7cffa22d52eda98a0594fc596ad0b39",
      "algorithm": "sha256",
      "digestDomain": "io.hacp.continuation-context.v0.3-candidate",
      "canonicalization": "json-rfc8785-jcs"
    }
  },
  "packetId": "taskpkt_wits_01a07ef6_c6e4_7efb_b147_f1647b6070ed",
  "decision": {
    "id": "decision_wits_01a07ef6_c769_77ed_8e3e_ee694f1a8054",
    "digest": {
      "value": "c98d362964b87981a1e1e5a035f7484dc8d97d17472f89b1561af45bd2d3f879",
      "algorithm": "sha256",
      "digestDomain": "io.hacp.human-decision.v0.3-candidate",
      "canonicalization": "json-rfc8785-jcs"
    }
  },
  "decisionRequest": {
    "kind": "review_finding",
    "id": "finding_wits_01a07ef6_c6e4_7efb_b147_f1647b6070ed",
    "digest": {
      "value": "da8ee20af9c6c63c2a266ceef6ece477ea819572dca7e6bea0aa32e633550059",
      "algorithm": "sha256",
      "digestDomain": "io.hacp.review-finding.v0.3-candidate",
      "canonicalization": "json-rfc8785-jcs"
    }
  },
  "consumptionReceiptId": "receipt_wits_01a07ef6_c79c_7e65_9180_409d631fb27d",
  "consumptionReceiptDigest": {
    "value": "7ff4055a74cf3905acadddbeb46efd94ef259014da83ae791bf22968a94e122d",
    "algorithm": "sha256",
    "digestDomain": "io.hacp.consumption-receipt.v0.3-candidate",
    "canonicalization": "json-rfc8785-jcs"
  },
  "successorInvocationId": "invoke_wits_hacp_v03_success_001",
  "startEvidence": {
    "digest": {
      "value": "0d7dc6dd164d81f438120d26da95ab018043718d46320a16bf840b854eb072cd",
      "algorithm": "sha256",
      "digestDomain": "io.hacp.successor-start-evidence.v0.3-candidate",
      "canonicalization": "json-rfc8785-jcs"
    },
    "recordId": "start_evidence_wits_01a07ef6_c79c_7df8_869a_e7b6f9542c36",
    "timeSource": "wits-postgresql-clock-timestamp",
    "evidenceRef": "wits://candidate-start/01a07ef6-c79c-7df8-869a-e7b6f9542c36",
    "workStartedAt": "2026-09-08T03:01:37.308Z",
    "validityReadbackRef": "wits://candidate-admission/01a07ef6-c79c-7e65-9180-409d631fb27d",
    "consumptionReceiptId": "receipt_wits_01a07ef6_c79c_7e65_9180_409d631fb27d",
    "successorInvocationId": "invoke_wits_hacp_v03_success_001",
    "acceptedClaimReadBackAt": "2026-09-08T03:01:37.308Z",
    "consumptionReceiptDigest": {
      "value": "7ff4055a74cf3905acadddbeb46efd94ef259014da83ae791bf22968a94e122d",
      "algorithm": "sha256",
      "digestDomain": "io.hacp.consumption-receipt.v0.3-candidate",
      "canonicalization": "json-rfc8785-jcs"
    }
  },
  "attemptedWork": [
    "produced public-safe HACP records"
  ],
  "evidenceRefs": [
    "evidence://wits/local-validator"
  ],
  "residualRisks": [
    "Candidate evidence does not prove distributed execution."
  ],
  "loopCounter": 0,
  "loopOutcome": "completed",
  "requestedNextHumanDecision": "decision_request_wits_01a07ef6_c7f9_737f_8e23_2fbbf01d1512",
  "boundaryStatement": "This report is immutable evidence for human review. It grants no merge, deployment, provider, or standard authority.",
  "digest": {
    "algorithm": "sha256",
    "canonicalization": "json-rfc8785-jcs",
    "digestDomain": "io.hacp.agent-report.v0.3-candidate",
    "value": "d99a734ada23eff4fd83f493e67dc51f53e713c231cc0d11a00b51c9e6bd4179"
  }
}
