{
  "recordKind": "hacp.v0_3_candidate.agent_report",
  "schemaVersion": "hacp-0.3-candidate",
  "reportId": "report_example_successor_001",
  "returnedAt": "2026-09-03T18:10:00Z",
  "digest": {
    "algorithm": "sha256",
    "canonicalization": "json-rfc8785-jcs",
    "digestDomain": "io.hacp.agent-report.v0.3-candidate",
    "value": "11485a2f6ae984c39774a8552ddd54a67cf9fbce7488ef1fd7dbdef49f666e0d"
  },
  "continuationContext": {
    "id": "context_example_successor_001",
    "digest": {
      "algorithm": "sha256",
      "canonicalization": "json-rfc8785-jcs",
      "digestDomain": "io.hacp.continuation-context.v0.3-candidate",
      "value": "004fdf803d6bfe61a18f71ae8f350013ae5232d866352ec83387d9ff6114d3e1"
    }
  },
  "packetId": "taskpkt_example_continue_review_001",
  "decision": {
    "id": "decision_example_approve_successor_001",
    "digest": {
      "algorithm": "sha256",
      "canonicalization": "json-rfc8785-jcs",
      "digestDomain": "io.hacp.human-decision.v0.3-candidate",
      "value": "545b43ca3c706c47090d953189d984506e6009a5efe5cfe03400edc0abcc0e0b"
    }
  },
  "decisionRequest": {
    "kind": "review_finding",
    "id": "finding_example_needs_owner_decision_001",
    "digest": {
      "algorithm": "sha256",
      "canonicalization": "json-rfc8785-jcs",
      "digestDomain": "io.hacp.review-finding.v0.3-candidate",
      "value": "eb4f41e53bcbe6a6f8bada28db2b4397996c7b3e2dc4d9349e35d42c40f95c95"
    }
  },
  "consumptionReceiptId": "receipt_example_claim_successor_001",
  "consumptionReceiptDigest": {
    "algorithm": "sha256",
    "canonicalization": "json-rfc8785-jcs",
    "digestDomain": "io.hacp.consumption-receipt.v0.3-candidate",
    "value": "826e13a192113d89e805ecd906d004cbe55e018e55721871d8c95a8a8f3d5bc1"
  },
  "successorInvocationId": "invoke_example_docs_worker_001",
  "startEvidence": {
    "recordId": "start_evidence_example_001",
    "evidenceRef": "evidence://example/successor-start-record",
    "digest": {
      "algorithm": "sha256",
      "canonicalization": "json-rfc8785-jcs",
      "digestDomain": "io.hacp.successor-start-evidence.v0.3-candidate",
      "value": "bca53a6750b9b15d0fc5d29caf00557aef93c8bcfb48c419e3a4816231543d4c"
    },
    "successorInvocationId": "invoke_example_docs_worker_001",
    "consumptionReceiptId": "receipt_example_claim_successor_001",
    "consumptionReceiptDigest": {
      "algorithm": "sha256",
      "canonicalization": "json-rfc8785-jcs",
      "digestDomain": "io.hacp.consumption-receipt.v0.3-candidate",
      "value": "826e13a192113d89e805ecd906d004cbe55e018e55721871d8c95a8a8f3d5bc1"
    },
    "acceptedClaimReadBackAt": "2026-09-03T18:05:01Z",
    "workStartedAt": "2026-09-03T18:05:02Z",
    "validityReadbackRef": "evidence://example/start-gate-validity-readback",
    "timeSource": "profile-defined-owner-ledger"
  },
  "attemptedWork": [
    "prepared docs-only v0.3 candidate text",
    "ran repository validation"
  ],
  "evidenceRefs": [
    "evidence://example/successor-start-record",
    "evidence://example/issuer-admission-record",
    "evidence://example/start-gate-validity-readback",
    "evidence://example/git-diff-check",
    "evidence://example/hacp-cli-bridge-examples",
    "evidence://example/ack-pr-loop"
  ],
  "residualRisks": [
    "external concurrency and expiry/revocation proof must be accepted before merge of this consumption-contract source packet",
    "illustrated issuer, uniqueness, and validity policies remain undefined; hypothetical references do not prove actual admission or current authority"
  ],
  "loopCounter": 0,
  "loopOutcome": "unobserved",
  "requestedNextHumanDecision": "review_draft_packet",
  "boundaryStatement": "The report is evidence for human review. It does not approve merge, release, or v0.3 conformance."
}
